{"$schema":"https://json-schema.org/draft/2020-12/schema","$id":"https://schemas.orchestra.dev/machine/design-source-preservation-workflow/1.0.0","title":"Orchestra Design Source Preservation Workflow","type":"object","additionalProperties":false,"required":["$schema","schema_version","workflow_id","role","consumes","produces","intake_order","preservation_precedence","required_rules","handoff","authority"],"properties":{"$schema":{"const":"../schemas/design-source-preservation-workflow.schema.json"},"schema_version":{"const":"orchestra.design-source-preservation-workflow.v1"},"workflow_id":{"const":"uix2-cloak-design-source-preservation"},"role":{"const":"CLOAK_DESIGN_SOURCE_PRESERVATION"},"consumes":{"type":"object","additionalProperties":false,"required":["ui_design_contract_schema","supported_source_providers"],"properties":{"ui_design_contract_schema":{"const":"machine/schemas/ui-design-contract.schema.json"},"supported_source_providers":{"type":"array","prefixItems":[{"const":"FIGMA"},{"const":"PROJECT_NATIVE"},{"const":"STORYBOOK"},{"const":"SCREENSHOT"},{"const":"REFERENCE_IMAGE"},{"const":"OTHER_STRUCTURED"},{"const":"NONE"}],"items":false,"minItems":7,"maxItems":7}}},"produces":{"type":"object","additionalProperties":false,"required":["preservation_report_schema"],"properties":{"preservation_report_schema":{"const":"machine/schemas/design-source-preservation-report.schema.json"}}},"intake_order":{"type":"array","prefixItems":[{"const":"VERIFY_SOURCE_IDENTITY"},{"const":"INVENTORY_DESIGN_EVIDENCE"},{"const":"RESOLVE_PROJECT_NATIVE_MAPPINGS"},{"const":"PRESERVE_TOKENS_COMPONENTS_ASSETS"},{"const":"REPORT_UNRESOLVED_EVIDENCE"},{"const":"ISSUE_PRE_IMPLEMENTATION_HANDOFF"}],"items":false,"minItems":6,"maxItems":6},"preservation_precedence":{"type":"array","prefixItems":[{"const":"EXACT_SUPPLIED_OR_PROJECT_EVIDENCE"},{"const":"EXISTING_PROJECT_COMPONENT"},{"const":"SEMANTIC_TOKEN_MAPPING"},{"const":"APPROVED_ADAPTATION"},{"const":"UNRESOLVED_NO_GUESS"}],"items":false,"minItems":5,"maxItems":5},"required_rules":{"type":"object","additionalProperties":false,"required":["structured_evidence_first","project_native_reuse_first","exact_assets_first","semantic_tokens_before_raw_values","silent_inference_allowed","missing_evidence_becomes_unresolved","implementation_without_intake_report_allowed","screenshot_is_authority","external_tool_is_authority"],"properties":{"structured_evidence_first":{"const":true},"project_native_reuse_first":{"const":true},"exact_assets_first":{"const":true},"semantic_tokens_before_raw_values":{"const":true},"silent_inference_allowed":{"const":false},"missing_evidence_becomes_unresolved":{"const":true},"implementation_without_intake_report_allowed":{"const":false},"screenshot_is_authority":{"const":false},"external_tool_is_authority":{"const":false}}},"handoff":{"type":"object","additionalProperties":false,"required":["design_owner","architecture_owner","implementation_owner","rendered_evidence_owner","transition_owner","governance_ip_owner"],"properties":{"design_owner":{"const":"cloak"},"architecture_owner":{"const":"clockwork"},"implementation_owner":{"const":"ponytail"},"rendered_evidence_owner":{"const":"overseer"},"transition_owner":{"const":"arbiter"},"governance_ip_owner":{"const":"the-governor"}}},"authority":{"type":"object","additionalProperties":false,"required":["workflow_grants_implementation_authority","external_tools_grant_authority","report_grants_authority","dependency_adoption_authorized","figma_mutation_authorized"],"properties":{"workflow_grants_implementation_authority":{"const":false},"external_tools_grant_authority":{"const":false},"report_grants_authority":{"const":false},"dependency_adoption_authorized":{"const":false},"figma_mutation_authorized":{"const":false}}}}}