{"$schema":"../schemas/design-source-preservation-workflow.schema.json","schema_version":"orchestra.design-source-preservation-workflow.v1","workflow_id":"uix2-cloak-design-source-preservation","role":"CLOAK_DESIGN_SOURCE_PRESERVATION","consumes":{"ui_design_contract_schema":"machine/schemas/ui-design-contract.schema.json","supported_source_providers":["FIGMA","PROJECT_NATIVE","STORYBOOK","SCREENSHOT","REFERENCE_IMAGE","OTHER_STRUCTURED","NONE"]},"produces":{"preservation_report_schema":"machine/schemas/design-source-preservation-report.schema.json"},"intake_order":["VERIFY_SOURCE_IDENTITY","INVENTORY_DESIGN_EVIDENCE","RESOLVE_PROJECT_NATIVE_MAPPINGS","PRESERVE_TOKENS_COMPONENTS_ASSETS","REPORT_UNRESOLVED_EVIDENCE","ISSUE_PRE_IMPLEMENTATION_HANDOFF"],"preservation_precedence":["EXACT_SUPPLIED_OR_PROJECT_EVIDENCE","EXISTING_PROJECT_COMPONENT","SEMANTIC_TOKEN_MAPPING","APPROVED_ADAPTATION","UNRESOLVED_NO_GUESS"],"required_rules":{"structured_evidence_first":true,"project_native_reuse_first":true,"exact_assets_first":true,"semantic_tokens_before_raw_values":true,"silent_inference_allowed":false,"missing_evidence_becomes_unresolved":true,"implementation_without_intake_report_allowed":false,"screenshot_is_authority":false,"external_tool_is_authority":false},"handoff":{"design_owner":"cloak","architecture_owner":"clockwork","implementation_owner":"ponytail","rendered_evidence_owner":"overseer","transition_owner":"arbiter","governance_ip_owner":"the-governor"},"authority":{"workflow_grants_implementation_authority":false,"external_tools_grant_authority":false,"report_grants_authority":false,"dependency_adoption_authorized":false,"figma_mutation_authorized":false}}